{
  "id": "r7-8840u",
  "vendor": "AMD",
  "name": "Ryzen 7 8840U",
  "codename": "Hawk Point",
  "cores": 8,
  "threads": 16,
  "core_mix": "8x Zen 4",
  "cpu_arch": "Zen 4",
  "base_ghz": 3.3,
  "boost_ghz": 5.1,
  "tdp_w": {
    "default": 28,
    "min": 15,
    "max": 30
  },
  "process_nm": 4,
  "process_note": "TSMC 4nm FinFET",
  "npu_tops": 16,
  "memory": "DDR5-5600, LPDDR5X-7500, dual-channel, up to 96 GB DDR5 / 64 GB LPDDR5X",
  "launch_date": "2023-12-06",
  "igpu": {
    "name": "Radeon 780M",
    "cu": 12,
    "arch": "RDNA 3",
    "clock_mhz": 2700,
    "tflops_fp32": 4.15
  },
  "passmark": {
    "cpu_mark": 23366,
    "single_thread": 3539,
    "cpu_samples": 609,
    "cpu_url": "https://www.cpubenchmark.net/cpu.php?cpu=AMD+Ryzen+7+8840U&id=6003",
    "g3d_mark": 6724,
    "g3d_samples": 12851,
    "gpu_url": "https://www.videocardbenchmark.net/gpu.php?gpu=Radeon+780M&id=4818",
    "fetched": "2026-10-27",
    "mapping_note": "CPU and GPU: exact entries."
  },
  "notes": "AMD lists the NPU at up to 16 TOPS (38 TOPS overall). igpu.tflops_fp32 = shaders x 2 FLOP x vendor max GPU clock (single-issue FMA; RDNA 3 dual-issue is not counted). PassMark scores mix TDPs and host devices; treat them as a rough guide only.",
  "unresolved": [],
  "sources": [
    {
      "field": "*",
      "url": "https://www.amd.com/en/products/processors/laptop/ryzen/8000-series/amd-ryzen-7-8840u.html",
      "accessed": "2026-10-27",
      "note": "AMD spec page: CPU, memory, NPU and iGPU fields (no launch date)"
    },
    {
      "field": "passmark.cpu_mark",
      "url": "https://www.cpubenchmark.net/cpu.php?cpu=AMD+Ryzen+7+8840U&id=6003",
      "accessed": "2026-10-27",
      "note": "CPU Mark, single thread rating and samples"
    },
    {
      "field": "passmark.g3d_mark",
      "url": "https://www.videocardbenchmark.net/gpu.php?gpu=Radeon+780M&id=4818",
      "accessed": "2026-10-27",
      "note": "G3D Mark and samples"
    },
    {
      "field": "launch_date",
      "url": "https://www.techpowerup.com/cpu-specs/ryzen-7-8840u.c3402",
      "accessed": "2026-10-27",
      "note": "TPU: release Dec 6th, 2023"
    },
    {
      "field": "igpu.tflops_fp32",
      "url": "https://www.techpowerup.com/gpu-specs/radeon-780m.c4221",
      "accessed": "2026-10-27",
      "note": "cross-check only; TPU lists 8.294 TFLOPS (Hawk Point 780M; counts RDNA 3 dual-issue)"
    }
  ]
}
