{
  "id": "arc-g3",
  "vendor": "Intel",
  "name": "Arc G3",
  "codename": "Panther Lake",
  "cores": 14,
  "threads": 14,
  "core_mix": "2P + 8E + 4LPE",
  "cpu_arch": "Cougar Cove + Darkmont",
  "base_ghz": 1.9,
  "boost_ghz": 4.6,
  "tdp_w": {
    "default": 25,
    "min": 15,
    "max": 80
  },
  "process_nm": 1.8,
  "process_note": "Intel 18A (per ARK); TPU lists 3 nm",
  "npu_tops": 46,
  "memory": "LPDDR5X-8533, dual-channel, up to 96 GB",
  "launch_date": "2026-05-28",
  "igpu": {
    "name": "Intel Arc B370",
    "cu": 10,
    "arch": "Xe3",
    "clock_mhz": 2200,
    "tflops_fp32": 5.63
  },
  "passmark": {
    "cpu_mark": 28624,
    "single_thread": 4056,
    "cpu_samples": 9,
    "cpu_url": "https://www.cpubenchmark.net/cpu.php?cpu=Intel+Arc+G3+Extreme&id=7300",
    "g3d_mark": 8483,
    "g3d_samples": 57,
    "gpu_url": "https://www.videocardbenchmark.net/gpu.php?gpu=Intel+Arc+B370+GPU&id=7972",
    "fetched": "2026-10-27",
    "mapping_note": "CPU: PassMark has no 'Intel Arc G3' entry; stand-in = 'Intel Arc G3 Extreme' (same 2P + 8E + 4LPE die and 25 W base power; the G3 boosts to 4.6 GHz instead of 4.7 GHz). GPU: 'Intel Arc B370 GPU' entry (57 samples, mostly Panther Lake-H laptops at higher power)."
  },
  "notes": "Intel brands it 'Intel Arc G3 Processor' (processor number G3); no Core Ultra model number. Used by the MSI Claw 8 EX AI+ (CG3M). base_ghz is the P-core base (E-core and LP E-core 1.5 GHz). No Hyper-Threading. NPU 46 TOPS. launch_date from TPU; ARK says Q2'26. Intel tdp_w: default = Processor Base Power, min = Minimum Assured Power, max = Maximum Turbo Power (PL2); PL2 is not comparable to an AMD cTDP maximum. igpu.tflops_fp32 = shaders x 2 FLOP x vendor max GPU clock (single-issue FMA; RDNA 3 dual-issue is not counted). PassMark scores mix TDPs and host devices; treat them as a rough guide only.",
  "unresolved": [],
  "sources": [
    {
      "field": "*",
      "url": "https://www.intel.com/content/www/us/en/products/sku/245626/intel-arc-g3-processor-12m-cache-up-to-4-60-ghz/specifications.html",
      "accessed": "2026-10-27",
      "note": "Intel ARK: cores, clocks, power, Intel 18A, memory, Arc B370 GPU with 10 Xe-cores at 2.2 GHz, NPU 46 TOPS"
    },
    {
      "field": "passmark.cpu_mark",
      "url": "https://www.cpubenchmark.net/cpu.php?cpu=Intel+Arc+G3+Extreme&id=7300",
      "accessed": "2026-10-27",
      "note": "CPU Mark, single thread rating and samples"
    },
    {
      "field": "passmark.g3d_mark",
      "url": "https://www.videocardbenchmark.net/gpu.php?gpu=Intel+Arc+B370+GPU&id=7972",
      "accessed": "2026-10-27",
      "note": "G3D Mark and samples"
    },
    {
      "field": "launch_date",
      "url": "https://www.techpowerup.com/cpu-specs/arc-g3.c4436",
      "accessed": "2026-10-27",
      "note": "TPU: release May 28th, 2026"
    },
    {
      "field": "cpu_arch",
      "url": "https://www.techpowerup.com/cpu-specs/arc-g3.c4436",
      "accessed": "2026-10-27",
      "note": "TPU: Cougar Cove P-cores, Darkmont E-cores"
    }
  ]
}
