{
  "id": "r7-5800u",
  "vendor": "AMD",
  "name": "Ryzen 7 5800U",
  "codename": "Cezanne",
  "cores": 8,
  "threads": 16,
  "core_mix": "8x Zen 3",
  "cpu_arch": "Zen 3",
  "base_ghz": 1.9,
  "boost_ghz": 4.4,
  "tdp_w": {
    "default": 15,
    "min": 10,
    "max": 25
  },
  "process_nm": 7,
  "process_note": "TSMC 7nm FinFET",
  "npu_tops": 0,
  "memory": "DDR4-3200, LPDDR4X-4266, dual-channel",
  "launch_date": "2021-01-12",
  "igpu": {
    "name": "Radeon Vega 8",
    "cu": 8,
    "arch": "Vega (GCN 5)",
    "clock_mhz": 2000,
    "tflops_fp32": 2.05
  },
  "passmark": {
    "cpu_mark": 17934,
    "single_thread": 2982,
    "cpu_samples": 995,
    "cpu_url": "https://www.cpubenchmark.net/cpu.php?cpu=AMD+Ryzen+7+5800U&id=4102",
    "g3d_mark": 2369,
    "g3d_samples": 708,
    "gpu_url": "https://www.videocardbenchmark.net/gpu.php?gpu=Radeon+Ryzen+7+5800U&id=4464",
    "fetched": "2026-10-27",
    "mapping_note": "CPU: exact entry. GPU: chip-named entry 'Radeon Ryzen 7 5800U' (708 samples); the iGPU reports as 'AMD Radeon Graphics'."
  },
  "notes": "AMD names the iGPU only 'AMD Radeon Graphics' with 8 graphics cores; TPU calls it Radeon Vega 8. npu_tops 0: the vendor spec page lists no AI engine (NPU absent or fused off). igpu.tflops_fp32 = shaders x 2 FLOP x vendor max GPU clock (single-issue FMA; RDNA 3 dual-issue is not counted). PassMark scores mix TDPs and host devices; treat them as a rough guide only.",
  "unresolved": [],
  "sources": [
    {
      "field": "*",
      "url": "https://www.amd.com/en/support/downloads/drivers.html/processors/ryzen/ryzen-5000-series/amd-ryzen-7-5800u.html",
      "accessed": "2026-10-27",
      "note": "the AMD product page returns 404; this AMD driver page carries the full spec table"
    },
    {
      "field": "passmark.cpu_mark",
      "url": "https://www.cpubenchmark.net/cpu.php?cpu=AMD+Ryzen+7+5800U&id=4102",
      "accessed": "2026-10-27",
      "note": "CPU Mark, single thread rating and samples"
    },
    {
      "field": "passmark.g3d_mark",
      "url": "https://www.videocardbenchmark.net/gpu.php?gpu=Radeon+Ryzen+7+5800U&id=4464",
      "accessed": "2026-10-27",
      "note": "G3D Mark and samples"
    },
    {
      "field": "cpu_arch",
      "url": "https://www.techpowerup.com/cpu-specs/ryzen-7-5800u.c2746",
      "accessed": "2026-10-27",
      "note": "TPU: Zen 3 (Cezanne); AMD's table omits the architecture row"
    },
    {
      "field": "igpu.name",
      "url": "https://www.techpowerup.com/cpu-specs/ryzen-7-5800u.c2746",
      "accessed": "2026-10-27",
      "note": "TPU: Radeon Vega 8"
    }
  ]
}
