{
  "id": "z2",
  "vendor": "AMD",
  "name": "Ryzen Z2",
  "codename": "Hawk Point",
  "cores": 8,
  "threads": 16,
  "core_mix": "8x Zen 4",
  "cpu_arch": "Zen 4",
  "base_ghz": 3.3,
  "boost_ghz": 5.1,
  "tdp_w": {
    "default": 28,
    "min": 15,
    "max": 30
  },
  "process_nm": 4,
  "process_note": "TSMC 4nm",
  "npu_tops": 0,
  "memory": "DDR5-5600, LPDDR5X-7500, dual-channel",
  "launch_date": "2025-01-06",
  "igpu": {
    "name": "Radeon 780M-class (12 CU)",
    "cu": 12,
    "arch": "RDNA 3",
    "clock_mhz": 2700,
    "tflops_fp32": 4.15
  },
  "passmark": {
    "cpu_mark": 25765,
    "single_thread": 3547,
    "cpu_samples": 12,
    "cpu_url": "https://www.cpubenchmark.net/cpu.php?cpu=AMD+Ryzen+Z2&id=7086",
    "g3d_mark": 6724,
    "g3d_samples": 12851,
    "gpu_url": "https://www.videocardbenchmark.net/gpu.php?gpu=Radeon+780M&id=4818",
    "fetched": "2026-10-27",
    "mapping_note": "CPU: exact entry 'AMD Ryzen Z2' (only 12 samples). GPU: no Z2 iGPU entry; stand-in 'Radeon 780M' (laptop twin with the same 12 CU RDNA 3 at 2.7 GHz)."
  },
  "notes": "Separate chip from the Ryzen Z2 Extreme and Ryzen AI Z2 Extreme. npu_tops 0: the vendor spec page lists no AI engine (NPU absent or fused off). igpu.tflops_fp32 = shaders x 2 FLOP x vendor max GPU clock (single-issue FMA; RDNA 3 dual-issue is not counted). PassMark scores mix TDPs and host devices; treat them as a rough guide only.",
  "unresolved": [],
  "sources": [
    {
      "field": "*",
      "url": "https://www.amd.com/en/products/processors/handhelds/ryzen-z-series/z2-series/z2.html",
      "accessed": "2026-10-27",
      "note": "AMD spec page: cores, clocks, TDP, iGPU CU and clock"
    },
    {
      "field": "passmark.cpu_mark",
      "url": "https://www.cpubenchmark.net/cpu.php?cpu=AMD+Ryzen+Z2&id=7086",
      "accessed": "2026-10-27",
      "note": "CPU Mark, single thread rating and samples"
    },
    {
      "field": "passmark.g3d_mark",
      "url": "https://www.videocardbenchmark.net/gpu.php?gpu=Radeon+780M&id=4818",
      "accessed": "2026-10-27",
      "note": "G3D Mark and samples"
    },
    {
      "field": "codename",
      "url": "https://www.techpowerup.com/cpu-specs/ryzen-z2.c4603",
      "accessed": "2026-10-27",
      "note": "TPU: Hawk Point"
    },
    {
      "field": "launch_date",
      "url": "https://www.techpowerup.com/cpu-specs/ryzen-z2.c4603",
      "accessed": "2026-10-27",
      "note": "TPU: release Jan 6th, 2025"
    },
    {
      "field": "process_nm",
      "url": "https://www.techpowerup.com/cpu-specs/ryzen-z2.c4603",
      "accessed": "2026-10-27",
      "note": "TPU: TSMC 4 nm"
    },
    {
      "field": "memory",
      "url": "https://www.techpowerup.com/cpu-specs/ryzen-z2.c4603",
      "accessed": "2026-10-27",
      "note": "TPU: DDR5-5600, LPDDR5X-7500"
    },
    {
      "field": "igpu.tflops_fp32",
      "url": "https://www.techpowerup.com/gpu-specs/ryzen-z2-gpu.c4303",
      "accessed": "2026-10-27",
      "note": "cross-check only; TPU lists 8.294 TFLOPS (counts RDNA 3 dual-issue at 2700 MHz)"
    }
  ]
}
